,id,title,score,num_comments,author,created_utc,url,over_18,edited,spoiler,stickied
0,1g6j3zn,"I received an offer to be a Senior Data Engineer... with Microsoft Fabric, would you consider it?",83,72,Irachar,1729260986.0,https://www.reddit.com/r/dataengineering/comments/1g6j3zn/i_received_an_offer_to_be_a_senior_data_engineer/,False,False,False,False
1,1g6ijjk,Should managers discourage late-night work?,59,31,NoUsernames1eft,1729259449.0,https://www.reddit.com/r/dataengineering/comments/1g6ijjk/should_managers_discourage_latenight_work/,False,False,False,False
2,1g6r8wa,Things every DE should know to be considered Senior,35,28,computersmakeart,1729281598.0,https://www.reddit.com/r/dataengineering/comments/1g6r8wa/things_every_de_should_know_to_be_considered/,False,1729283568.0,False,False
3,1g6i7v0,Data Engineering — Courses to Get Better at Work,36,6,rickdawlton,1729258554.0,https://www.reddit.com/r/dataengineering/comments/1g6i7v0/data_engineering_courses_to_get_better_at_work/,False,False,False,False
4,1g6t40a,How much statistics do you use as a data engineer?,29,39,what_duck,1729286726.0,https://www.reddit.com/r/dataengineering/comments/1g6t40a/how_much_statistics_do_you_use_as_a_data_engineer/,False,False,False,False
5,1g6me2j,Explain like I am 5 what's Reverse ETL?,29,48,Judessaa,1729269071.0,https://www.reddit.com/r/dataengineering/comments/1g6me2j/explain_like_i_am_5_whats_reverse_etl/,False,False,False,False
6,1g6nt62,"How do you process csv's with more than one ""table"" in it?",19,32,subhash_peshwa,1729272701.0,https://www.reddit.com/r/dataengineering/comments/1g6nt62/how_do_you_process_csvs_with_more_than_one_table/,False,1729277902.0,False,False
7,1g6ilg0,The Enterprise Case for DuckDB: 5 Key Use Cases Categories and Why Use It,12,2,TransportationOk2403,1729259600.0,https://motherduck.com/blog/duckdb-enterprise-5-key-categories/,False,False,False,False
8,1g6g0wk,"Visual data editor for JSON, YAML, CSV, XML to diagram",10,2,iamCut,1729251760.0,https://www.reddit.com/r/dataengineering/comments/1g6g0wk/visual_data_editor_for_json_yaml_csv_xml_to/,False,False,False,False
9,1g6twhc,Need advice on moving on from SSIS but without Python,8,12,Mugiwara_JTres3,1729288882.0,https://www.reddit.com/r/dataengineering/comments/1g6twhc/need_advice_on_moving_on_from_ssis_but_without/,False,False,False,False
10,1g6defr,How to replicate data from AWS Aurora MySQL to Snowflake?,8,7,BubblyImpress7078,1729240838.0,https://www.reddit.com/r/dataengineering/comments/1g6defr/how_to_replicate_data_from_aws_aurora_mysql_to/,False,False,False,False
11,1g6wvte,Could someone explain to me what a Data Platform Engineer is? What exactly do they do and how are they different from Data Engineers?,9,3,LyleLanleysMonorail,1729297713.0,https://www.reddit.com/r/dataengineering/comments/1g6wvte/could_someone_explain_to_me_what_a_data_platform/,False,False,False,False
12,1g6jj1i,A Guide to dbt Macros,6,1,AMDataLake,1729262101.0,https://open.substack.com/pub/amdatalakehouse/p/a-guide-to-dbt-macros?r=h4f8p&utm_campaign=post&utm_medium=web&showWelcomeOnShare=true,False,False,False,False
13,1g6fj7h,To dbt or not dbt?,3,9,LUYAL69,1729249987.0,https://www.reddit.com/r/dataengineering/comments/1g6fj7h/to_dbt_or_not_dbt/,False,False,False,False
14,1g6yur8,Lead Data Engineer Duties,5,12,Used_Ad_2628,1729304081.0,https://www.reddit.com/r/dataengineering/comments/1g6yur8/lead_data_engineer_duties/,False,False,False,False
15,1g6wr6l,Looking for Mentor and/or Courses for Old-School SQL Server,2,1,i_am_baldilocks,1729297314.0,https://www.reddit.com/r/dataengineering/comments/1g6wr6l/looking_for_mentor_andor_courses_for_oldschool/,False,False,False,False
16,1g6uo03,creating visualization (a map) Aws SageMaker ,2,1,No_Violinist_1329,1729291066.0,https://www.reddit.com/r/dataengineering/comments/1g6uo03/creating_visualization_a_map_aws_sagemaker/,False,False,False,False
17,1g6s3wh,Airflow Data Aware Scheduling utilizing a Snowflake table,2,3,rileymprice,1729283853.0,https://www.reddit.com/r/dataengineering/comments/1g6s3wh/airflow_data_aware_scheduling_utilizing_a/,False,False,False,False
18,1g6qr1y,What platform should I be using for cloud computing? Willing to pay $$ for help!,5,13,Pitiful-Reaction9534,1729280289.0,https://www.reddit.com/r/dataengineering/comments/1g6qr1y/what_platform_should_i_be_using_for_cloud/,False,False,False,False
19,1g6naev,Best approach for implementing an analytical database across multiple data residency regions?,2,0,Rude_Catch2202,1729271374.0,https://www.reddit.com/r/dataengineering/comments/1g6naev/best_approach_for_implementing_an_analytical/,False,False,False,False
20,1g6mntc,"MapReduce , Hadoop and Spark tutoriels ",2,1,LahmeriMohamed,1729269770.0,https://www.reddit.com/r/dataengineering/comments/1g6mntc/mapreduce_hadoop_and_spark_tutoriels/,False,False,False,False
21,1g6fabb,I need some advice on my DWH architecture,2,3,MrTotoroLV,1729249103.0,https://www.reddit.com/r/dataengineering/comments/1g6fabb/i_need_some_advice_on_my_dwh_architecture/,False,False,False,False
22,1g73bfz,"Umpteenth SHOULD I post,  I hope you enjoy",1,0,dhumantorch,1729321303.0,https://www.reddit.com/r/dataengineering/comments/1g73bfz/umpteenth_should_i_post_i_hope_you_enjoy/,False,False,False,False
23,1g73b0g,All this Databricks vs Snowflake rivalry is BS,13,3,DataOnDrugs,1729321263.0,https://www.reddit.com/r/dataengineering/comments/1g73b0g/all_this_databricks_vs_snowflake_rivalry_is_bs/,False,False,False,False
24,1g7198y,Is there a scope for data engineers to get extra part time job like software engineers?,1,2,bhoo1,1729312615.0,https://www.reddit.com/r/dataengineering/comments/1g7198y/is_there_a_scope_for_data_engineers_to_get_extra/,False,False,False,False
25,1g6fpna,Anyone using Pathway.com stream processor library in production,1,0,yasser_sinjab,1729250655.0,https://www.reddit.com/r/dataengineering/comments/1g6fpna/anyone_using_pathwaycom_stream_processor_library/,False,False,False,False
26,1g6y8wy,Architecture for quantitative trading application ,0,2,remster85,1729302048.0,https://www.reddit.com/r/dataengineering/comments/1g6y8wy/architecture_for_quantitative_trading_application/,False,False,False,False
27,1g6e7ri,Revolutionizing SQL with pipe syntax,0,18,slowpush,1729244624.0,https://cloud.google.com/blog/products/data-analytics/simplify-your-sql-with-pipe-syntax-in-bigquery-and-cloud-logging,False,False,False,False
28,1g6nv55,Pliable.co Experience,0,1,PencilBoy99,1729272837.0,https://www.reddit.com/r/dataengineering/comments/1g6nv55/pliableco_experience/,False,False,False,False
29,1g6thuu,Introducing Fireball-Meta-Llama-3.1-8B-Instruct-Agent-0.003-128K-code-ds: A Game-Changer in Data Science!,0,3,Haunting-Ad6565,1729287770.0,https://www.reddit.com/r/dataengineering/comments/1g6thuu/introducing/,False,False,False,False
